{
  "case_id": "AIE_DDX_EXAMPLE_001",
  "version": "0.4",
  "track": "reference-alignment",
  "public_input": {
    "molecule": {
      "structure": {
        "format": "smiles",
        "value": "CCO"
      }
    },
    "task": "Starting from the SMILES structure only, autonomously investigate possible AIE/photophysical mechanisms. Report generated evidence, supported mechanisms, weakened or rejected mechanisms, underdetermined mechanisms, necessary wet-lab follow-ups, and a final evidence-grounded mechanistic diagnosis."
  },
  "hidden_reference": {
    "source_article": {
      "candidate_id": "EXAMPLE_001",
      "doi": "10.0000/example",
      "title": "Synthetic validation fixture",
      "molecule_label": "Example"
    },
    "reference_evidence_units": [
      {
        "evidence_id": "E01",
        "claim": "The synthetic source reports an environment-dependent emission change.",
        "mechanistic_interpretation": "The observation is used only to test the schema and link validator.",
        "mechanism_links": ["RIM_RIR_RIV"],
        "evidence_accessibility": "synthetic_fixture",
        "source_span": "Synthetic fixture, sentence 1",
        "paper_quote": "The synthetic source reports an environment-dependent emission change."
      }
    ],
    "reference_diagnosis_units": [
      {
        "diagnosis_id": "D01",
        "mechanism": "RIM_RIR_RIV",
        "context": "Synthetic schema fixture.",
        "reference_status": "underdetermined",
        "expert_conclusion": "The fixture does not establish a real mechanism.",
        "supporting_evidence_ids": ["E01"],
        "diagnosis_role": "underdetermined_followup_needed"
      },
      {
        "diagnosis_id": "D02",
        "mechanism": "FINAL_EVIDENCE_GROUNDED_DIAGNOSIS",
        "context": "Synthetic final synthesis.",
        "reference_status": "supported",
        "expert_conclusion": "This is a non-scientific fixture for validating the data contract.",
        "supporting_evidence_ids": ["E01"],
        "diagnosis_role": "final_synthesis"
      }
    ]
  }
}
